[
 {
  "school": "cmu",
  "pi": "Kris M Kitani",
  "student": "cmu_person_ri_142292",
  "action": "rename",
  "name": "Yu-Jhe Li",
  "person": "ext:cmu:yu-jhe-li",
  "reason": "The record's only Kitani evidence is Yu-Jhe Li's 2023 PhD dissertation (figshare article 24268864, advisor Kitani); RI person 142292 is a different person, Yu-Hsuan (Eva) Li, an MSCV student with no adviser.",
  "evidence": [
   {
    "url": "https://www.ri.cmu.edu/wp-json/people/v1/get_programs",
    "sha256": "33dee59bc4c800c26f1ff02e2c117bfd5f4e7981dc1a92f22af8bcb4ca7787e3",
    "quote": "\"name\":\"Yuan Li\""
   },
   {
    "url": "https://www.ri.cmu.edu/wp-json/people/v1/get_programs",
    "sha256": "33dee59bc4c800c26f1ff02e2c117bfd5f4e7981dc1a92f22af8bcb4ca7787e3",
    "quote": "\"title\":\"Rob - Kitani - PhD Student\""
   },
   {
    "url": "https://www.ri.cmu.edu/wp-json/people/v1/get_programs",
    "sha256": "33dee59bc4c800c26f1ff02e2c117bfd5f4e7981dc1a92f22af8bcb4ca7787e3",
    "quote": "\"andrew_id\":\"yuhsuanl\",\"legacy_id\":142292"
   },
   {
    "url": "https://www.ri.cmu.edu/wp-json/people/v1/get_programs",
    "sha256": "33dee59bc4c800c26f1ff02e2c117bfd5f4e7981dc1a92f22af8bcb4ca7787e3",
    "quote": "\"preferred_name\":\"Yu-Hsuan (Eva)\",\"admin_assistant\":null,\"homepage_url\":\"\",\"google_scholar_url\":\"\",\"status\":\"publish\",\"programs\":[{\"ri_program\":\"mscv\",\"ri_matriculation_date\":\"08\\/26\\/2024\",\"ri_completion\":true,\"ri_completion_date\":\"12\\/17\\/2025\",\"ri_thesis\":\"\",\"ri_advisors\":false"
   },
   {
    "url": "https://www.ri.cmu.edu/ri-people/yu-hsuan-li/",
    "sha256": "8d48064bc5e98071f5341fd898d3b8c17921a8b90c462d885247fd2418a1746a",
    "quote": "Yu-Hsuan Li Completed Program: Program: MSCV Date Completed: December 2025"
   },
   {
    "url": "https://api.figshare.com/v2/articles/24268864",
    "sha256": "8dd1df37c7b67f79d6db5a931e78a38972f674100e0c5ae36cc7e4e4c1181ef0",
    "quote": "\"full_name\": \"Yu-Jhe Li\""
   },
   {
    "url": "https://kriskitani.github.io/",
    "sha256": "542614c20bf4bcaee37f5b4ac4205a1692eb87defd84d717d67892f26badb5d0",
    "quote": "Current Members: Navyata Sanghvi (RI PhD) Jyun-Ting Song (RI PhD) Yuan Li (RI PhD)"
   }
  ]
 },
 {
  "school": "cmu",
  "pi": "Martial Hebert",
  "student": "cmu_person_7df9d05472762d323782",
  "action": "drop",
  "reason": "Yu-Xiang Wang's ML/Statistics PhD thesis (CMU-ML-17-105) committee is Tibshirani (chair), Fienberg, Lei, Smola, Smith: no Hebert. Hebert advised a different person, Yuxiong (Yu-Xiong) Wang (RI thesis 2018).",
  "evidence": [
   {
    "url": "http://reports-archive.adm.cs.cmu.edu/anon/ml2017/abstracts/17-105.html",
    "sha256": "850a34c977c162d3d9a5dcbb46ab17a048bca7d7069d2d02c463ec3c0182d3b0",
    "quote": "CMU-ML-17-105 New Paradigms and Optimality Guarantees in Statistical Learning and Estimation Yu-Xiang Wang December 2017 Ph.D. Thesis Joint Machine Learning Department"
   },
   {
    "url": "http://reports-archive.adm.cs.cmu.edu/anon/ml2017/abstracts/17-105.html",
    "sha256": "850a34c977c162d3d9a5dcbb46ab17a048bca7d7069d2d02c463ec3c0182d3b0",
    "quote": "Thesis Committee: Ryan J. Tibshirani (Chair) Stephen E. Fienberg Jing Lei Alexander J. Smola Adam D. Smith (Boston University)"
   },
   {
    "url": "https://www.ri.cmu.edu/event/learning-to-learn-for-small-sample-visual-recognition/",
    "sha256": "c0d244f9562296da823bf619cfc7a47b2410cf8ef8372d281b5038bf69d6cd98",
    "quote": "PhD Thesis Defense May 8 Tue Yuxiong Wang Robotics Institute, Carnegie Mellon University"
   },
   {
    "url": "https://www.ri.cmu.edu/event/learning-to-learn-for-small-sample-visual-recognition/",
    "sha256": "c0d244f9562296da823bf619cfc7a47b2410cf8ef8372d281b5038bf69d6cd98",
    "quote": "Thesis Committee Members : Martial Hebert, Chair Deva Ramanan Ruslan Salakhutdinov Andrew Zisserman, University of Oxford"
   },
   {
    "url": "https://www.ri.cmu.edu/wp-json/people/v1/get_programs",
    "sha256": "aff64ed6a47cb7c80fdbb270b983ec757ddc63d6bbdaf9b286a97150f3afcd82",
    "quote": "\"name\": \"Yuxiong Wang\", \"slug\": \"yuxiong-wang\", \"status\": \"publish\", \"programIndex\": 0, \"program\": \"phd\", \"matriculation\": \"08/20/2012\", \"completed\": true, \"completionDate\": \"05/20/2018\", \"advisers\": [{\"name\": \"Martial Hebert\""
   }
  ]
 },
 {
  "school": "berkeley",
  "pi": "Pieter Abbeel",
  "student": "ext:berkeley:yilin-wu",
  "action": "replace_sources",
  "years": [
   2020
  ],
  "role": "undergraduate",
  "sources": [
   {
    "url": "https://people.eecs.berkeley.edu/~pabbeel/group.html",
    "sha256": "490358352a1d46ba5a4296e490e34cebc51e181ce8ed01c4b80c8e42eb508181",
    "quote": "Finalist Yilin Wu 2020 Stanford, MS in CS"
   }
  ],
  "reason": "The old quote ran on from the previous table row ('PhD in CS X Finalist Yilin Wu', year 2021); the group page's own row is 'Finalist Yilin Wu 2020 Stanford, MS in CS': an Abbeel-lab undergraduate, class of 2020.",
  "evidence": [
   {
    "url": "https://web.archive.org/web/20170429200412id_/https://bair.berkeley.edu/students.html",
    "sha256": "c4c563736fe6cc7fc21c291100c57a9c239c0cee741514b8243940f0c2123f01",
    "quote": "Yi Wu Adv.: Pieter Abbeel , Stuart Russell Probabilistic Inference, Machine Learning, Deep Reinforcement Learning"
   },
   {
    "url": "https://people.eecs.berkeley.edu/~pabbeel/group.html",
    "sha256": "490358352a1d46ba5a4296e490e34cebc51e181ce8ed01c4b80c8e42eb508181",
    "quote": "Finalist Yilin Wu 2020 Stanford, MS in CS"
   }
  ]
 },
 {
  "school": "stanford",
  "pi": "Tatsunori Hashimoto",
  "student": "stanford_stu_xuechen-li",
  "action": "rename",
  "name": "Xuechen Li",
  "reason": "Hashimoto's profile shows this advisee as 'Chen Li' linking profiles.stanford.edu/xuechen-li; the student publishes as Xuechen Li. 'Chen Li' stays an alias.",
  "evidence": [
   {
    "url": "https://web.archive.org/web/20230601090530id_/https://profiles.stanford.edu/tatsunori-hashimoto",
    "sha256": "2a18ce5d71983932817e9a18724a33cb577109f80e196bf81f95618f0959654a",
    "quote": "<a href=\"https://profiles.stanford.edu/xuechen-li\">Chen Li</a>"
   },
   {
    "url": "https://web.archive.org/web/20230601090530id_/https://profiles.stanford.edu/tatsunori-hashimoto",
    "sha256": "2a18ce5d71983932817e9a18724a33cb577109f80e196bf81f95618f0959654a",
    "quote": "Doctoral Dissertation Advisor (AC) Yann Dubois , Chen Li"
   },
   {
    "url": "https://web.archive.org/web/20230606231105id_/https://profiles.stanford.edu/xuechen-li",
    "sha256": "f117e99b9393db746af2b23177fe5fe8b3710503429779cf2f2c4cd9dc8facd5",
    "quote": "Chen Li Ph.D. Student in Computer Science, admitted Winter 2021"
   },
   {
    "url": "https://profiles.stanford.edu/tatsunori-hashimoto",
    "sha256": "fd36913e1f0637413ab681f8f0123ecc872ec1cbf6f8e2ad381b0d82a736eea2",
    "quote": "<a href=\"https://profiles.stanford.edu/liangyu-chen\">Liangyu Chen</a>"
   },
   {
    "url": "https://profiles.stanford.edu/liangyu-chen",
    "sha256": "d7112d5bcd6ee652ba248364cea1afa4ea84a5d7a139cc22fbebe4dadf456180",
    "quote": "Liangyu Chen Ph.D. Student in Computer Science, admitted Autumn 2024"
   }
  ]
 },
 {
  "school": "stanford",
  "pi": "James Zou",
  "student": "stanford_stu_shirley-yingxin-wu",
  "action": "replace_sources",
  "type": "thesis_adviser",
  "years": [
   2026
  ],
  "role": "phd",
  "sources": [
   {
    "url": "https://purl.stanford.edu/kt076zd0858.mods",
    "sha256": "eb3cd956371403c99fde2380e9ff5f176b916d497c07c7284bd8e1bb41cd63c4",
    "quote": "<name type=\"personal\"> <namePart>Zou, James</namePart> <role> <roleTerm type=\"text\">degree supervisor</roleTerm> </role> <role> <roleTerm type=\"text\">thesis advisor</roleTerm> </role> </name>"
   }
  ],
  "reason": "2026-10-29 (owner: accuracy sample) review of 'Shirley Wu sits in Zou's lab but her thesis names Leskovec': the thesis record (Stanford Digital Repository MODS, kt076zd0858) names both Jurij Leskovec and James Zou as degree supervisor and thesis advisor, so she is co-advised and stays in both labs. Zou's relation had carried a quote cut to Leskovec's entry ('Leskovec, Jurij degree supervisor thesis advisor'); it now quotes Zou's own entry of the same capture (whitespace-normalized, as every quote of the thesis harvest is).",
  "evidence": [
   {
    "url": "https://purl.stanford.edu/kt076zd0858.mods",
    "sha256": "eb3cd956371403c99fde2380e9ff5f176b916d497c07c7284bd8e1bb41cd63c4",
    "quote": "<name type=\"personal\"> <namePart>Zou, James</namePart> <role> <roleTerm type=\"text\">degree supervisor</roleTerm> </role> <role> <roleTerm type=\"text\">thesis advisor</roleTerm> </role> </name>"
   },
   {
    "url": "https://purl.stanford.edu/kt076zd0858.mods",
    "sha256": "eb3cd956371403c99fde2380e9ff5f176b916d497c07c7284bd8e1bb41cd63c4",
    "quote": "<name type=\"personal\"> <namePart>Leskovec, Jurij</namePart> <role> <roleTerm type=\"text\">degree supervisor</roleTerm> </role> <role> <roleTerm type=\"text\">thesis advisor</roleTerm> </role> </name>"
   }
  ]
 }
]
